{
  "contractVersion": "1.0.0",
  "authorityStatus": "DERIVED",
  "nonAuthoritative": true,
  "featureId": "reference-architecture-example",
  "risk": "R3",
  "acceptanceCriteriaIds": [
    "AC-001",
    "AC-002",
    "AC-003",
    "AC-004",
    "AC-005",
    "AC-006",
    "AC-007",
    "AC-008"
  ],
  "review": {
    "status": "PASS",
    "reference": "Assets/Project/Docs/Specifications/reference-architecture-example/PROVENANCE_RECONSTRUCTION.md"
  },
  "approval": {
    "status": "APPROVED",
    "references": [
      "Assets/Project/Docs/Specifications/reference-architecture-example/PROVENANCE_RECONSTRUCTION.md"
    ]
  },
  "implementationPlan": {
    "status": "APPROVED",
    "reference": "Assets/Project/Docs/Specifications/reference-architecture-example/PROVENANCE_RECONSTRUCTION.md"
  },
  "implementationState": "COMPLETE",
  "validation": {
    "status": "PASS",
    "reference": "Assets/Project/Docs/Specifications/reference-architecture-example/PROVENANCE_RECONSTRUCTION.md"
  },
  "sync": {
    "status": "NOT_STARTED",
    "reference": null
  },
  "adrReferences": []
}
